{
  "metadata": {
    "chapterNumber": 5,
    "title": "Seeing Eyes Helping Hands",
    "subject": "English",
    "pages": "16-20",
    "description": "Four types of invitations for a school project inauguration. Grammar: Punctuation marks ‚Äî full stop, comma, question mark, exclamation mark, hyphen, dash."
  },
  "preAssessment": [
    {
      "id": "q1",
      "question": "How many types of invitations are shown in the chapter 'Seeing Eyes, Helping Hands'?",
      "options": [
        "Four",
        "Two",
        "Three",
        "Five"
      ],
      "correctAnswer": "A",
      "difficulty": "easy",
      "conceptId": 1
    },
    {
      "id": "q2",
      "question": "Which punctuation mark is used at the end of a statement?",
      "options": [
        "Full stop (.)",
        "Question mark (?)",
        "Exclamation mark (!)",
        "Comma (,)"
      ],
      "correctAnswer": "A",
      "difficulty": "easy",
      "conceptId": 5
    },
    {
      "id": "q3",
      "question": "Which punctuation mark is used at the end of a question?",
      "options": [
        "Question mark (?)",
        "Full stop (.)",
        "Exclamation mark (!)",
        "Hyphen (-)"
      ],
      "correctAnswer": "A",
      "difficulty": "easy",
      "conceptId": 5
    },
    {
      "id": "q4",
      "question": "Which type of invitation is sent in printed form for formal occasions?",
      "options": [
        "Formal printed invitation",
        "Written notice",
        "Oral phone invitation",
        "Oral personal invitation"
      ],
      "correctAnswer": "A",
      "difficulty": "medium",
      "conceptId": 1
    },
    {
      "id": "q5",
      "question": "What does a hyphen (-) connect?",
      "options": [
        "Two parts of a compound word",
        "Two sentences",
        "A list of items",
        "A question to its answer"
      ],
      "correctAnswer": "A",
      "difficulty": "medium",
      "conceptId": 5
    }
  ],
  "concepts": [
    {
      "id": 1,
      "title": "Formal Printed Invitation",
      "emoji": "üíå",
      "colorTheme": "from-blue-400 to-cyan-500",
      "bgColor": "bg-blue-50",
      "borderColor": "border-blue-300",
      "content": "A formal printed invitation is prepared for special occasions like school programmes, marriages, or official events. It includes all important details: who is organizing, what the event is, who will inaugurate it, who will preside, the time, the venue, and the names of organizers. A formal invitation is printed and distributed in advance.",
      "pageReference": "16-17",
      "examples": [
        {
          "icon": "üè´",
          "text": "School invites parents to the inauguration of 'Seeing Eyes, Helping Hands' project"
        },
        {
          "icon": "üë§",
          "text": "Name of the inaugurator and the presiding person are mentioned"
        },
        {
          "icon": "üìç",
          "text": "Venue, date and time are clearly stated"
        },
        {
          "icon": "üìÆ",
          "text": "The invitation is printed and given/posted to guests in advance"
        }
      ],
      "keyPoints": [
        "Formal invitations are used for official or important events",
        "Must include: who, what, programme, inaugurator, presiding person, time, venue",
        "Language is polite and formal",
        "Printed invitations are given in advance",
        "Both the organizer's and RSVP details may be included"
      ],
      "funFact": "In Indian culture, printed invitations for weddings and festivals are considered very important ‚Äî families often spend time designing beautiful invitation cards!",
      "textbookRef": "Pages 16-17: Type A ‚Äî Formal Printed Invitation"
    },
    {
      "id": 2,
      "title": "Written Notice",
      "emoji": "üìã",
      "colorTheme": "from-purple-400 to-pink-500",
      "bgColor": "bg-purple-50",
      "borderColor": "border-purple-300",
      "content": "A written notice is a shorter, simpler form of invitation displayed on a notice board or distributed in a school or office. It covers the key details but in a brief format. A school notice for a programme might include the event name, date, time, venue, and who should attend. It is less formal than a printed invitation but more official than a verbal message.",
      "pageReference": "17-18",
      "examples": [
        {
          "icon": "üìå",
          "text": "Notice pinned on school notice board announcing the programme"
        },
        {
          "icon": "üìÖ",
          "text": "Date, time, and venue clearly mentioned in brief"
        },
        {
          "icon": "‚úçÔ∏è",
          "text": "Signed by the teacher or headmaster at the bottom"
        }
      ],
      "keyPoints": [
        "A written notice is displayed on a notice board or distributed",
        "It is shorter and simpler than a formal printed invitation",
        "Includes event, date, time, venue, and who should attend",
        "It is signed by an authority (teacher/headmaster)",
        "Language is clear and to the point"
      ],
      "funFact": "In schools across Maharashtra, notice boards near the school entrance display important announcements ‚Äî these are a form of written notice that students see every day!",
      "textbookRef": "Pages 17-18: Type B ‚Äî Written Notice"
    },
    {
      "id": 3,
      "title": "Oral and Telephone Invitations",
      "emoji": "üìû",
      "colorTheme": "from-green-400 to-emerald-500",
      "bgColor": "bg-green-50",
      "borderColor": "border-green-300",
      "content": "An oral invitation is given in person or over the telephone. When given by telephone, the person speaks clearly, introduces themselves, states the occasion, time, venue, and requests the person's presence. An oral personal invitation is given face-to-face with similar details. Both require polite, clear language and confirmation from the invitee.",
      "pageReference": "18-19",
      "examples": [
        {
          "icon": "üì±",
          "text": "Calling a guest on phone: 'Good morning! This is Arjun. I am inviting you to our school programme...'"
        },
        {
          "icon": "ü§ù",
          "text": "Personal invitation: meeting someone and verbally inviting them"
        },
        {
          "icon": "üó£Ô∏è",
          "text": "Clearly stating: event name, date, time, venue in the spoken invitation"
        }
      ],
      "keyPoints": [
        "Oral telephone invitation is given over the phone",
        "Oral personal invitation is given face-to-face",
        "Must include: event, time, venue, and a polite request",
        "Language should be polite and clear in spoken invitations",
        "Confirm the guest's attendance after the invitation"
      ],
      "funFact": "Before mobile phones, people sent postcards or telegrams to invite guests! Today, WhatsApp messages and phone calls have become the most common way to invite people in India.",
      "textbookRef": "Pages 18-19: Types C and D ‚Äî Oral Invitations"
    },
    {
      "id": 4,
      "title": "Comparing the Four Types of Invitations",
      "emoji": "üîç",
      "colorTheme": "from-orange-400 to-red-500",
      "bgColor": "bg-orange-50",
      "borderColor": "border-orange-300",
      "content": "The four types of invitations ‚Äî formal printed, written notice, telephone, and personal ‚Äî differ in their format, level of detail, and purpose. A formal invitation includes all 8 key points. A written notice covers most points briefly. An oral telephone invitation covers the essential points verbally. A personal invitation is the most casual and immediate.",
      "pageReference": "19-20",
      "examples": [
        {
          "icon": "üíå",
          "text": "Formal printed: most detailed, used for important events"
        },
        {
          "icon": "üìã",
          "text": "Written notice: brief, used for school/office announcements"
        },
        {
          "icon": "üìû",
          "text": "Telephone: spoken, used for urgent or personal invitations"
        },
        {
          "icon": "üó£Ô∏è",
          "text": "Personal: face-to-face, most casual and immediate"
        }
      ],
      "keyPoints": [
        "Formal printed invitation: most detailed, all 8 points, used for major events",
        "Written notice: brief, official, displayed on notice board",
        "Telephone invitation: oral, immediate, polite spoken language",
        "Personal invitation: face-to-face, warmest and most direct",
        "The choice of invitation type depends on the occasion and the person being invited"
      ],
      "funFact": "For weddings in India, families often use ALL four types: printed cards, WhatsApp notices, phone calls, and personal visits ‚Äî because weddings are very important occasions!",
      "textbookRef": "Pages 19-20: Comparing invitation types"
    },
    {
      "id": 5,
      "title": "Punctuation Rules",
      "emoji": "‚úèÔ∏è",
      "colorTheme": "from-indigo-400 to-purple-500",
      "bgColor": "bg-indigo-50",
      "borderColor": "border-indigo-300",
      "content": "Punctuation marks help us read and understand sentences correctly. A full stop (.) ends a statement. A comma (,) separates items in a list or clauses. A question mark (?) ends a question. An exclamation mark (!) shows strong feeling. A hyphen (-) joins parts of a compound word (e.g., well-known). A dash (‚Äì) shows a pause or adds information.",
      "pageReference": "20",
      "examples": [
        {
          "icon": ".",
          "text": "Full stop: The school is clean. (ends a statement)"
        },
        {
          "icon": ",",
          "text": "Comma: I like mangoes, bananas, and apples."
        },
        {
          "icon": "?",
          "text": "Question mark: What time is the programme?"
        },
        {
          "icon": "!",
          "text": "Exclamation mark: What a beautiful day!"
        }
      ],